{
  "$schema": "https://json-schema.org/draft/2020-12/schema",
  "$id": "https://ticon.pages.dev/schema/ticon-pack-1.json",
  "title": "Icon pack ticon",
  "description": "Icon pack menimpa SEBAGIAN peta ikon dan digabung di atas peta dasar, berbeda dengan ticon-map/2 yang peta lengkapnya sendiri. Semua bagian opsional kecuali `schema` dan `pack`. Nama field memakai huruf besar-kecil bahasa Inggris karena ini format yang dibaca mesin di luar repo ini; dokumentasi prose tetap bahasa Indonesia.",
  "type": "object",
  "required": ["schema", "pack"],
  "additionalProperties": false,
  "properties": {
    "$schema": { "type": "string" },
    "schema": { "const": "ticon-pack/1" },
    "pack": {
      "type": "object",
      "required": ["name", "version"],
      "additionalProperties": false,
      "description": "Metadata pack. `name` untuk pack bawaan harus sama dengan nama pack-nya, supaya `--icons-pack shape` tidak pernah diam-diam memakai pack lain.",
      "properties": {
        "name": { "type": "string", "minLength": 1 },
        "version": { "type": "string", "minLength": 1 },
        "description": { "type": "string" },
        "author": { "type": "string" },
        "license": { "type": "string" },
        "min_ticon": {
          "type": "string",
          "description": "Versi ticon paling tua yang bisa memakainya, mis. \"0.4.3\". Hanya dua komponen pertama yang dibandingkan. Tepat di atas versi yang berjalan = ditolak dengan pesan."
        }
      }
    },
    "families": {
      "type": "object",
      "additionalProperties": { "type": "string" },
      "description": "Keluarga → warna. Menambah atau menimpa keluarga dari peta dasar. Warna harus sudah ada di palet ticon. Dibaca lebih dulu, jadi `rules` dan `shapes` boleh memakai keluarga yang baru ditambah di sini."
    },
    "rules": {
      "type": "array",
      "description": "Aturan yang menimpa peta dasar. Aturan dengan pasangan (kind, key) yang sudah ada DIGANTI, bukan ditumpuk: kunci dicabut dari semua kategori lalu dimasukkan ke kategori (family, glyph) yang diminta. Dua aturan dengan (kind, key) sama di dalam satu pack ditolak.",
      "items": {
        "type": "object",
        "required": ["kind", "key", "family", "glyph"],
        "additionalProperties": false,
        "properties": {
          "kind": { "enum": ["name", "suffix", "prefix", "ext", "dir"] },
          "key": {
            "type": "string",
            "minLength": 1,
            "description": "Untuk `ext` harus diawali titik; untuk `dir` harus huruf kecil. Aturan yang tidak akan pernah menang ditolak, bukan diabaikan."
          },
          "family": { "type": "string", "minLength": 1 },
          "glyph": {
            "type": "string",
            "minLength": 1,
            "description": "Nama glyph dari assets/glyphs.toml. Glyph yang tidak dikenal ditolak."
          }
        }
      }
    },
    "shapes": {
      "type": "object",
      "additionalProperties": { "type": "string", "minLength": 1, "maxLength": 4 },
      "description": "Keluarga → bentuk cadangan satu karakter, dipakai kalau glyph Nerd Font tidak bisa digambar. Nilai harus tepat SATU karakter: dua karakter membuat janji 'satu sel' jadi bohong dan merusak kolom. Karakter di private-use (U+E000-U+F8FF) secara teknis lolos validasi, tapi bentuk seperti itu butuh Nerd Font juga — pakai blok Latin/Geometric, bukan PUA."
    },
    "folder_shape": {
      "type": "string",
      "minLength": 1,
      "maxLength": 4,
      "description": "Bentuk cadangan untuk folder, satu karakter. Kalau tidak diisi, folder memakai bentuk keluarganya."
    }
  }
}
